Risk	Plugin ID	Name	Port	Protocol	Host	CVE	CVSS	Description	Solution
Critical	53514	MS11-030: Vulnerability in DNS Resolution Could Allow Remote Code Execution (2509553) (remote check)	53	udp	192.168.57.159	CVE-2011-0657	9.3	A vulnerability in DNS resolution could allow remote code execution on the target Windows host.	Apply Microsoft Security Update MS11-030
Critical	108797	Unsupported Windows OS (remote)	445	tcp	192.168.57.159	N/A	10	The remote host is running Windows 7 which reached end of life on January 14 2020 and no longer receives security patches.	Upgrade to a supported version of Windows
High	97833	MS17-010: Security Update for Microsoft Windows SMB Server (4013389) (ETERNALBLUE) (ETERNALCHAMPION) (ETERNALROMANCE) (ETERNALSYNERGY) (WannaCry) (EternalRocks) (Petya) (uncredentialed check)	445	tcp	192.168.57.159	CVE-2017-0143	9.3	The remote Windows host is missing the MS17-010 security update. It is affected by multiple RCE vulnerabilities in SMBv1 exploited by EternalBlue/WannaCry/Petya.	Apply Microsoft Security Update MS17-010 (KB4013389)
Medium	90510	MS16-047: Security Update for SAM and LSAD Remote Protocols (3148527) (Badlock) (uncredentialed check)	445	tcp	192.168.57.159	CVE-2016-0128	5.8	A security feature bypass vulnerability known as Badlock exists in the SAM and LSAD remote protocols.	Apply Microsoft Security Update MS16-047
Medium	57608	SMB Signing not required	445	tcp	192.168.57.159	N/A	4.3	The remote SMB server does not enforce message signing allowing man-in-the-middle attacks.	Enforce SMB message signing in host configuration
Info	96982	Server Message Block (SMB) Protocol Version 1 Enabled (uncredentialed check)	445	tcp	192.168.57.159	N/A	0	The remote host has SMBv1 enabled which contains known critical vulnerabilities including MS17-010.	Disable SMBv1 on the remote host
Low	10114	ICMP Timestamp Request Remote Date Disclosure	0	icmp	192.168.57.159	N/A	0	The remote host responds to ICMP timestamp requests disclosing the system date.	Filter ICMP timestamp requests with a firewall
Info	10736	DCE Services Enumeration	135	tcp	192.168.57.159	N/A	0	By sending a Lookup request to the portmapper the remote DCE services running on the remote host were enumerated.	N/A
Info	11219	Nessus SYN scanner	0	tcp	192.168.57.159	N/A	0	Nessus performed a SYN scan to identify open TCP ports on the remote host.	N/A
Info	11011	Microsoft Windows SMB Service Detection	445	tcp	192.168.57.159	N/A	0	The remote host is running a version of Microsoft Windows SMB service.	N/A
Info	45590	Common Platform Enumeration (CPE)	0	tcp	192.168.57.159	N/A	0	The remote host was identified as Windows 7 via CPE enumeration.	N/A
Info	54615	Device Type	0	tcp	192.168.57.159	N/A	0	The remote host was identified as a general-purpose device running Windows.	N/A
Info	35716	Ethernet Card Manufacturer Detection	0	tcp	192.168.57.159	N/A	0	The manufacturer of the remote host NIC was identified via its MAC address OUI.	N/A
Info	86420	Ethernet MAC Addresses	0	tcp	192.168.57.159	N/A	0	The MAC address of the remote host network interface was detected.	N/A
Info	53513	Link-Local Multicast Name Resolution (LLMNR) Detection	5355	udp	192.168.57.159	N/A	0	The remote host is listening on UDP port 5355 and will respond to LLMNR requests.	Consider disabling LLMNR if not needed
Info	19506	Nessus Scan Information	0	tcp	192.168.57.159	N/A	0	Information about the Nessus scan performed against this target.	N/A
Info	209654	OS Fingerprints Detected	0	tcp	192.168.57.159	N/A	0	OS fingerprinting identified the remote host as Microsoft Windows 7.	N/A
Info	11936	OS Identification	0	tcp	192.168.57.159	N/A	0	The remote host was identified as running Microsoft Windows 7 Ultimate.	N/A
Info	117886	OS Security Patch Assessment Not Available	0	tcp	192.168.57.159	N/A	0	Nessus was unable to perform patch assessment as no credentials were provided.	Provide credentials to enable authenticated scanning
Info	110723	Target Credential Status by Authentication Protocol - No Credentials Provided	0	tcp	192.168.57.159	N/A	0	Nessus did not have credentials for the target. Some checks were skipped.	Provide valid credentials for more thorough assessment
Info	25220	TCP/IP Timestamps Supported	0	tcp	192.168.57.159	N/A	0	The remote host supports TCP timestamps allowing uptime estimation.	N/A
Info	10287	Traceroute Information	0	udp	192.168.57.159	N/A	0	Network traceroute information was collected for the remote host.	N/A
Info	20094	VMware Virtual Machine Detection	0	tcp	192.168.57.159	N/A	0	The remote host was detected as a VMware virtual machine based on its MAC address OUI (00:0C:29).	N/A
